[{"place_id":"NMS:CINMS","place_name":"Channel Islands National Marine Sanctuary","coll":"places","place_coll":"places","indicator":"obis:bp","kind":"new","time_grain":"year","from_status":null,"to_status":null,"from_time":null,"to_time":"2025-01-01","value":0.12,"unit":"","seen":"2026-10-23","sentence":"OBIS Berger-Parker dominance, all taxa in Channel Islands National Marine Sanctuary has its first value: 0.12 for 2025."},
{"place_id":"NMS:CINMS","place_name":"Channel Islands National Marine Sanctuary","coll":"places","place_coll":"places","indicator":"erddap:dhw_5km:CRW_SST:mean","kind":"period","time_grain":"year","from_status":"within","to_status":"within","from_time":"2024-01-01","to_time":"2025-01-01","value":16.4,"unit":"°C","seen":"2026-10-23","sentence":"Sea surface temperature (CRW, 5 km) in Channel Islands National Marine Sanctuary has a value for 2025: 16.4 °C; the last was for 2024."},
{"place_id":"NMS:FGBNMS","place_name":"Flower Garden Banks National Marine Sanctuary","coll":"places","place_coll":"places","indicator":"erddap:dhw_5km:CRW_SST:mean","kind":"status","time_grain":"year","from_status":"within","to_status":"above","from_time":"2025-01-01","to_time":"2025-01-01","value":27.9,"unit":"°C","seen":"2026-10-23","sentence":"Sea surface temperature (CRW, 5 km) in Flower Garden Banks National Marine Sanctuary is now above its own record (2025); it was within its own record."}]
