[{"place_id":"MRGID:5670","place_name":"Albanian Exclusive Economic Zone","coll":"mr_eez","place_coll":"mr_eez","indicator":"erddap:IMERG_monthly_global_precip:precipitation:mean","kind":"new","time_grain":"year","from_status":null,"to_status":"within","from_time":null,"to_time":"2024-01-01","value":86.175842235373,"unit":"mm","seen":"2026-10-22","sentence":"Precipitation (NASA IMERG) in Albanian Exclusive Economic Zone has its first value: 86.2 mm for 2024."}]
