[{"place_id":"NMS:PMNM","place_name":"Papahānaumokuākea Marine National Monument","coll":"places","place_coll":"places","indicator":"erddap:dhw_5km:CRW_SST:mean","kind":"status","time_grain":"year","from_status":null,"to_status":"above","from_time":"2026-09-01","to_time":"2025-01-01","value":25.373163430200673,"unit":"°C","seen":"2026-10-21","sentence":"Sea surface temperature (CRW, 5 km) in Papahānaumokuākea Marine National Monument has its first status: above its own record (2025)."}]
